[
  {
    "id": 1,
    "start_ts": 0.0,
    "end_ts": 2.5,
    "start_frame": 0,
    "end_frame": 75,
    "scene": "bedroom",
    "verb": "Folds",
    "object": "bedsheet",
    "action": "Folds the bedsheet."
  },
  {
    "id": 2,
    "start_ts": 2.5,
    "end_ts": 5.0,
    "start_frame": 75,
    "end_frame": 150,
    "scene": "bedroom",
    "verb": "Pulls",
    "object": "bedsheet",
    "action": "Pulls the bedsheet."
  },
  {
    "id": 3,
    "start_ts": 5.0,
    "end_ts": 8.0,
    "start_frame": 150,
    "end_frame": 240,
    "scene": "bedroom",
    "verb": "Pushes",
    "object": "bedsheet",
    "action": "Pushes the bedsheet."
  },
  {
    "id": 4,
    "start_ts": 8.0,
    "end_ts": 10.0,
    "start_frame": 240,
    "end_frame": 300,
    "scene": "bedroom",
    "verb": "Walks",
    "object": "",
    "action": "Walks."
  },
  {
    "id": 5,
    "start_ts": 10.0,
    "end_ts": 18.5,
    "start_frame": 300,
    "end_frame": 555,
    "scene": "bedroom",
    "verb": "Pushes",
    "object": "bedsheet",
    "action": "Pushes the bedsheet."
  },
  {
    "id": 6,
    "start_ts": 18.5,
    "end_ts": 20.0,
    "start_frame": 555,
    "end_frame": 600,
    "scene": "bedroom",
    "verb": "Walks",
    "object": "",
    "action": "Walks."
  },
  {
    "id": 7,
    "start_ts": 20.0,
    "end_ts": 21.2,
    "start_frame": 600,
    "end_frame": 636,
    "scene": "bedroom",
    "verb": "Walks",
    "object": "towards the bed",
    "action": "Walks towards the bed."
  },
  {
    "id": 8,
    "start_ts": 21.2,
    "end_ts": 22.8,
    "start_frame": 636,
    "end_frame": 684,
    "scene": "bedroom",
    "verb": "Places",
    "object": "pillow",
    "action": "Places the pillow."
  },
  {
    "id": 9,
    "start_ts": 22.8,
    "end_ts": 31.2,
    "start_frame": 684,
    "end_frame": 936,
    "scene": "bedroom",
    "verb": "Pulls",
    "object": "bedsheet",
    "action": "Pulls the bedsheet."
  },
  {
    "id": 10,
    "start_ts": 31.2,
    "end_ts": 36.0,
    "start_frame": 936,
    "end_frame": 1080,
    "scene": "bedroom",
    "verb": "Walks",
    "object": "around the bed",
    "action": "Walks around the bed."
  },
  {
    "id": 11,
    "start_ts": 36.0,
    "end_ts": 38.2,
    "start_frame": 1080,
    "end_frame": 1146,
    "scene": "bedroom",
    "verb": "Pulls",
    "object": "bedsheet",
    "action": "Pulls the bedsheet."
  },
  {
    "id": 12,
    "start_ts": 38.2,
    "end_ts": 40.0,
    "start_frame": 1146,
    "end_frame": 1200,
    "scene": "bedroom",
    "verb": "Folds",
    "object": "towel",
    "action": "Folds the towel."
  },
  {
    "id": 13,
    "start_ts": 40.0,
    "end_ts": 43.5,
    "start_frame": 1200,
    "end_frame": 1305,
    "scene": "bedroom",
    "verb": "Pulls",
    "object": "bedsheet",
    "action": "Pulls the bedsheet."
  },
  {
    "id": 14,
    "start_ts": 43.5,
    "end_ts": 47.5,
    "start_frame": 1305,
    "end_frame": 1425,
    "scene": "bedroom",
    "verb": "Inserts",
    "object": "bedsheet",
    "action": "Inserts the bedsheet."
  },
  {
    "id": 15,
    "start_ts": 47.5,
    "end_ts": 51.5,
    "start_frame": 1425,
    "end_frame": 1545,
    "scene": "bedroom",
    "verb": "Walks",
    "object": "",
    "action": "Walks."
  },
  {
    "id": 16,
    "start_ts": 51.5,
    "end_ts": 55.0,
    "start_frame": 1545,
    "end_frame": 1650,
    "scene": "bedroom",
    "verb": "Pulls",
    "object": "bedsheet",
    "action": "Pulls the bedsheet."
  },
  {
    "id": 17,
    "start_ts": 55.0,
    "end_ts": 60.0,
    "start_frame": 1650,
    "end_frame": 1800,
    "scene": "bedroom",
    "verb": "Inserts",
    "object": "bedsheet",
    "action": "Inserts the bedsheet."
  },
  {
    "id": 18,
    "start_ts": 60.0,
    "end_ts": 62.0,
    "start_frame": 1800,
    "end_frame": 1860,
    "scene": "bedroom",
    "verb": "Pulls",
    "object": "bedsheet",
    "action": "Pulls the bedsheet."
  },
  {
    "id": 19,
    "start_ts": 62.0,
    "end_ts": 63.5,
    "start_frame": 1860,
    "end_frame": 1905,
    "scene": "bedroom",
    "verb": "Walks",
    "object": "",
    "action": "Walks."
  },
  {
    "id": 20,
    "start_ts": 63.5,
    "end_ts": 69.5,
    "start_frame": 1905,
    "end_frame": 2085,
    "scene": "bedroom",
    "verb": "Pulls",
    "object": "bedsheet",
    "action": "Pulls the bedsheet."
  },
  {
    "id": 21,
    "start_ts": 69.5,
    "end_ts": 72.0,
    "start_frame": 2085,
    "end_frame": 2160,
    "scene": "bedroom",
    "verb": "Walks",
    "object": "",
    "action": "Walks."
  },
  {
    "id": 22,
    "start_ts": 72.0,
    "end_ts": 73.0,
    "start_frame": 2160,
    "end_frame": 2190,
    "scene": "bedroom",
    "verb": "Picks up",
    "object": "pillowcase",
    "action": "Picks up the pillowcase."
  },
  {
    "id": 23,
    "start_ts": 73.0,
    "end_ts": 80.0,
    "start_frame": 2190,
    "end_frame": 2400,
    "scene": "bedroom",
    "verb": "Unfolds",
    "object": "pillowcase",
    "action": "Unfolds the pillowcase."
  },
  {
    "id": 24,
    "start_ts": 80.0,
    "end_ts": 84.5,
    "start_frame": 2400,
    "end_frame": 2535,
    "scene": "bedroom",
    "verb": "Unfolds",
    "object": "sheet",
    "action": "Unfolds the sheet."
  },
  {
    "id": 25,
    "start_ts": 84.5,
    "end_ts": 94.5,
    "start_frame": 2535,
    "end_frame": 2835,
    "scene": "bedroom",
    "verb": "Unfolds",
    "object": "bedsheet",
    "action": "Unfolds the bedsheet."
  },
  {
    "id": 26,
    "start_ts": 94.5,
    "end_ts": 100.0,
    "start_frame": 2835,
    "end_frame": 3000,
    "scene": "bedroom",
    "verb": "Fluffs",
    "object": "bedsheet",
    "action": "Fluffs the bedsheet."
  },
  {
    "id": 27,
    "start_ts": 100.0,
    "end_ts": 105.5,
    "start_frame": 3000,
    "end_frame": 3165,
    "scene": "bedroom",
    "verb": "Walks",
    "object": "",
    "action": "Walks."
  },
  {
    "id": 28,
    "start_ts": 105.5,
    "end_ts": 107.5,
    "start_frame": 3165,
    "end_frame": 3225,
    "scene": "bedroom",
    "verb": "Picks up",
    "object": "quilt",
    "action": "Picks up the quilt."
  },
  {
    "id": 29,
    "start_ts": 107.5,
    "end_ts": 115.5,
    "start_frame": 3225,
    "end_frame": 3465,
    "scene": "bedroom",
    "verb": "Inserts",
    "object": "quilt into the duvet cover",
    "action": "Inserts the quilt into the duvet cover."
  },
  {
    "id": 30,
    "start_ts": 115.5,
    "end_ts": 120.0,
    "start_frame": 3465,
    "end_frame": 3600,
    "scene": "bedroom",
    "verb": "Fluffs",
    "object": "duvet",
    "action": "Fluffs the duvet."
  },
  {
    "id": 31,
    "start_ts": 120.0,
    "end_ts": 121.5,
    "start_frame": 3600,
    "end_frame": 3645,
    "scene": "bedroom",
    "verb": "Inserts",
    "object": "pillow into the pillowcase",
    "action": "Inserts the pillow into the pillowcase."
  },
  {
    "id": 32,
    "start_ts": 121.5,
    "end_ts": 132.5,
    "start_frame": 3645,
    "end_frame": 3975,
    "scene": "bedroom",
    "verb": "Fluffs",
    "object": "pillow",
    "action": "Fluffs the pillow."
  },
  {
    "id": 33,
    "start_ts": 132.5,
    "end_ts": 135.0,
    "start_frame": 3975,
    "end_frame": 4050,
    "scene": "bedroom",
    "verb": "Pulls",
    "object": "pillowcase",
    "action": "Pulls the pillowcase."
  },
  {
    "id": 34,
    "start_ts": 135.0,
    "end_ts": 137.5,
    "start_frame": 4050,
    "end_frame": 4125,
    "scene": "bedroom",
    "verb": "Fluffs",
    "object": "pillow",
    "action": "Fluffs the pillow."
  },
  {
    "id": 35,
    "start_ts": 137.5,
    "end_ts": 140.0,
    "start_frame": 4125,
    "end_frame": 4200,
    "scene": "bedroom",
    "verb": "Places",
    "object": "pillow on the bed",
    "action": "Places the pillow on the bed."
  },
  {
    "id": 36,
    "start_ts": 140.0,
    "end_ts": 143.0,
    "start_frame": 4200,
    "end_frame": 4290,
    "scene": "bedroom",
    "verb": "Unfolds",
    "object": "pillowcase",
    "action": "Unfolds the pillowcase."
  },
  {
    "id": 37,
    "start_ts": 143.0,
    "end_ts": 148.0,
    "start_frame": 4290,
    "end_frame": 4440,
    "scene": "bedroom",
    "verb": "Inserts",
    "object": "pillow into the pillowcase",
    "action": "Inserts the pillow into the pillowcase."
  },
  {
    "id": 38,
    "start_ts": 148.0,
    "end_ts": 150.0,
    "start_frame": 4440,
    "end_frame": 4500,
    "scene": "bedroom",
    "verb": "Fluffs",
    "object": "pillow",
    "action": "Fluffs the pillow."
  },
  {
    "id": 39,
    "start_ts": 150.0,
    "end_ts": 153.0,
    "start_frame": 4500,
    "end_frame": 4590,
    "scene": "bedroom",
    "verb": "Unfolds",
    "object": "duvet",
    "action": "Unfolds the duvet."
  },
  {
    "id": 40,
    "start_ts": 153.0,
    "end_ts": 160.0,
    "start_frame": 4590,
    "end_frame": 4800,
    "scene": "bedroom",
    "verb": "Folds",
    "object": "duvet",
    "action": "Folds the duvet."
  },
  {
    "id": 41,
    "start_ts": 160.0,
    "end_ts": 163.5,
    "start_frame": 4800,
    "end_frame": 4905,
    "scene": "bedroom",
    "verb": "Folds",
    "object": "bedsheet",
    "action": "Folds the bedsheet."
  },
  {
    "id": 42,
    "start_ts": 163.5,
    "end_ts": 165.5,
    "start_frame": 4905,
    "end_frame": 4965,
    "scene": "bedroom",
    "verb": "Walks",
    "object": "",
    "action": "Walks."
  },
  {
    "id": 43,
    "start_ts": 165.5,
    "end_ts": 178.5,
    "start_frame": 4965,
    "end_frame": 5355,
    "scene": "bedroom",
    "verb": "Inserts",
    "object": "pillow into the pillowcase",
    "action": "Inserts the pillow into the pillowcase."
  },
  {
    "id": 44,
    "start_ts": 178.5,
    "end_ts": 180.0,
    "start_frame": 5355,
    "end_frame": 5400,
    "scene": "bedroom",
    "verb": "Places",
    "object": "pillow onto the bed",
    "action": "Places the pillow onto the bed."
  }
]
