[
  {
    "id": 1,
    "start_ts": 0.0,
    "end_ts": 1.5,
    "start_frame": 0,
    "end_frame": 45,
    "scene": "kitchen",
    "verb": "Picks up",
    "object": "black container",
    "action": "Picks up the black container."
  },
  {
    "id": 2,
    "start_ts": 1.5,
    "end_ts": 9.3,
    "start_frame": 45,
    "end_frame": 279,
    "scene": "kitchen",
    "verb": "Pours",
    "object": "black container",
    "action": "Pours the residue from the container into the white trash can."
  },
  {
    "id": 3,
    "start_ts": 9.3,
    "end_ts": 13.567,
    "start_frame": 279,
    "end_frame": 407,
    "scene": "kitchen",
    "verb": "Places",
    "object": "black container",
    "action": "Places the black container."
  }
]
