[
  {
    "id": 1,
    "start_ts": 0.0,
    "end_ts": 3.5,
    "start_frame": 0,
    "end_frame": 105,
    "scene": "hotel room",
    "verb": "Folds",
    "object": "towel",
    "action": "Folds the towel."
  },
  {
    "id": 2,
    "start_ts": 3.5,
    "end_ts": 4.5,
    "start_frame": 105,
    "end_frame": 135,
    "scene": "hotel room",
    "verb": "Places",
    "object": "towel",
    "action": "Places the towel."
  },
  {
    "id": 3,
    "start_ts": 4.5,
    "end_ts": 6.5,
    "start_frame": 135,
    "end_frame": 195,
    "scene": "hotel room",
    "verb": "Walks",
    "object": "",
    "action": "Walks."
  },
  {
    "id": 4,
    "start_ts": 6.5,
    "end_ts": 9.0,
    "start_frame": 195,
    "end_frame": 270,
    "scene": "hotel room",
    "verb": "Picks up",
    "object": "water bottle",
    "action": "Picks up the water bottle."
  },
  {
    "id": 5,
    "start_ts": 9.0,
    "end_ts": 12.5,
    "start_frame": 270,
    "end_frame": 375,
    "scene": "hotel room",
    "verb": "Carries",
    "object": "water bottle",
    "action": "Carries the water bottle."
  },
  {
    "id": 6,
    "start_ts": 12.5,
    "end_ts": 13.5,
    "start_frame": 375,
    "end_frame": 405,
    "scene": "hotel room",
    "verb": "Places",
    "object": "water bottle",
    "action": "Places the water bottle."
  },
  {
    "id": 7,
    "start_ts": 13.5,
    "end_ts": 17.5,
    "start_frame": 405,
    "end_frame": 525,
    "scene": "hotel room",
    "verb": "Walks",
    "object": "",
    "action": "Walks."
  },
  {
    "id": 8,
    "start_ts": 17.5,
    "end_ts": 18.5,
    "start_frame": 525,
    "end_frame": 555,
    "scene": "hotel room",
    "verb": "Picks up",
    "object": "mop",
    "action": "Picks up the mop."
  },
  {
    "id": 9,
    "start_ts": 18.5,
    "end_ts": 40.0,
    "start_frame": 555,
    "end_frame": 1200,
    "scene": "hotel room",
    "verb": "Sweeps",
    "object": "floor",
    "action": "Sweeps the floor."
  },
  {
    "id": 10,
    "start_ts": 40.0,
    "end_ts": 41.5,
    "start_frame": 1200,
    "end_frame": 1245,
    "scene": "hotel room",
    "verb": "Wipes",
    "object": "table",
    "action": "Wipes the table."
  },
  {
    "id": 11,
    "start_ts": 41.5,
    "end_ts": 80.0,
    "start_frame": 1245,
    "end_frame": 2400,
    "scene": "hotel room",
    "verb": "Sweeps",
    "object": "floor",
    "action": "Sweeps the floor."
  },
  {
    "id": 12,
    "start_ts": 80.0,
    "end_ts": 100.0,
    "start_frame": 2400,
    "end_frame": 3000,
    "scene": "hotel room",
    "verb": "Wipes",
    "object": "floor",
    "action": "Wipes the floor."
  },
  {
    "id": 13,
    "start_ts": 100.0,
    "end_ts": 120.0,
    "start_frame": 3000,
    "end_frame": 3600,
    "scene": "hotel room",
    "verb": "Sweeps",
    "object": "floor",
    "action": "Sweeps the floor."
  },
  {
    "id": 14,
    "start_ts": 120.0,
    "end_ts": 140.0,
    "start_frame": 3600,
    "end_frame": 4200,
    "scene": "hotel room",
    "verb": "Wipes",
    "object": "floor",
    "action": "Wipes the floor."
  },
  {
    "id": 15,
    "start_ts": 140.0,
    "end_ts": 147.5,
    "start_frame": 4200,
    "end_frame": 4425,
    "scene": "hotel room",
    "verb": "Picks up",
    "object": "plastic bottle",
    "action": "Picks up the plastic bottle."
  },
  {
    "id": 16,
    "start_ts": 147.5,
    "end_ts": 149.5,
    "start_frame": 4425,
    "end_frame": 4485,
    "scene": "hotel room",
    "verb": "Walks",
    "object": "",
    "action": "Walks."
  },
  {
    "id": 17,
    "start_ts": 149.5,
    "end_ts": 155.5,
    "start_frame": 4485,
    "end_frame": 4665,
    "scene": "hotel room",
    "verb": "Places",
    "object": "plastic bottle",
    "action": "Places the plastic bottle."
  },
  {
    "id": 18,
    "start_ts": 155.5,
    "end_ts": 158.0,
    "start_frame": 4665,
    "end_frame": 4740,
    "scene": "hotel room",
    "verb": "Walks",
    "object": "",
    "action": "Walks."
  },
  {
    "id": 19,
    "start_ts": 158.0,
    "end_ts": 160.0,
    "start_frame": 4740,
    "end_frame": 4800,
    "scene": "hotel room",
    "verb": "Sweeps",
    "object": "floor",
    "action": "Sweeps the floor."
  },
  {
    "id": 20,
    "start_ts": 160.0,
    "end_ts": 163.2,
    "start_frame": 4800,
    "end_frame": 4896,
    "scene": "hotel room",
    "verb": "Picks up",
    "object": "plastic bag",
    "action": "Picks up the plastic bag."
  },
  {
    "id": 21,
    "start_ts": 163.2,
    "end_ts": 165.2,
    "start_frame": 4896,
    "end_frame": 4956,
    "scene": "hotel room",
    "verb": "Walks",
    "object": "",
    "action": "Walks."
  },
  {
    "id": 22,
    "start_ts": 165.2,
    "end_ts": 168.2,
    "start_frame": 4956,
    "end_frame": 5046,
    "scene": "hotel room",
    "verb": "Picks up",
    "object": "plastic bag",
    "action": "Picks up the plastic bag."
  },
  {
    "id": 23,
    "start_ts": 168.2,
    "end_ts": 174.5,
    "start_frame": 5046,
    "end_frame": 5235,
    "scene": "hotel room",
    "verb": "Unfolds",
    "object": "plastic bag",
    "action": "Unfolds the plastic bag."
  },
  {
    "id": 24,
    "start_ts": 174.5,
    "end_ts": 180.0,
    "start_frame": 5235,
    "end_frame": 5400,
    "scene": "hotel room",
    "verb": "Places",
    "object": "plastic bag",
    "action": "Places the plastic bag onto the trash bin."
  }
]
