[
  {
    "id": 1,
    "start_ts": 0.0,
    "end_ts": 2.5,
    "start_frame": 0,
    "end_frame": 75,
    "scene": "bathroom",
    "verb": "Picks up",
    "object": "cloth and squeegee",
    "action": "Picks up the cloth and squeegee."
  },
  {
    "id": 2,
    "start_ts": 2.5,
    "end_ts": 5.0,
    "start_frame": 75,
    "end_frame": 150,
    "scene": "bathroom",
    "verb": "Walks",
    "object": "to the sink",
    "action": "Walks to the sink."
  },
  {
    "id": 3,
    "start_ts": 5.0,
    "end_ts": 6.0,
    "start_frame": 150,
    "end_frame": 180,
    "scene": "bathroom",
    "verb": "Places",
    "object": "squeegee",
    "action": "Places the squeegee in the sink."
  },
  {
    "id": 4,
    "start_ts": 6.0,
    "end_ts": 17.5,
    "start_frame": 180,
    "end_frame": 525,
    "scene": "bathroom",
    "verb": "Washes",
    "object": "cloth",
    "action": "Washes the cloth."
  },
  {
    "id": 5,
    "start_ts": 17.5,
    "end_ts": 21.5,
    "start_frame": 525,
    "end_frame": 645,
    "scene": "bathroom",
    "verb": "Wrings",
    "object": "cloth",
    "action": "Wrings the cloth."
  },
  {
    "id": 6,
    "start_ts": 21.5,
    "end_ts": 23.0,
    "start_frame": 645,
    "end_frame": 690,
    "scene": "bathroom",
    "verb": "Walks",
    "object": "",
    "action": "Walks."
  },
  {
    "id": 7,
    "start_ts": 23.0,
    "end_ts": 26.0,
    "start_frame": 690,
    "end_frame": 780,
    "scene": "bathroom",
    "verb": "Opens",
    "object": "plastic bag",
    "action": "Opens the plastic bag."
  },
  {
    "id": 8,
    "start_ts": 26.0,
    "end_ts": 27.5,
    "start_frame": 780,
    "end_frame": 825,
    "scene": "bathroom",
    "verb": "Picks up",
    "object": "cup",
    "action": "Picks up the cup."
  },
  {
    "id": 9,
    "start_ts": 27.5,
    "end_ts": 28.5,
    "start_frame": 825,
    "end_frame": 855,
    "scene": "bathroom",
    "verb": "Turns on",
    "object": "faucet",
    "action": "Turns on the faucet."
  },
  {
    "id": 10,
    "start_ts": 28.5,
    "end_ts": 38.0,
    "start_frame": 855,
    "end_frame": 1140,
    "scene": "bathroom",
    "verb": "Washes",
    "object": "cloth",
    "action": "Washes the cloth."
  },
  {
    "id": 11,
    "start_ts": 38.0,
    "end_ts": 38.5,
    "start_frame": 1140,
    "end_frame": 1155,
    "scene": "bathroom",
    "verb": "Turns off",
    "object": "faucet",
    "action": "Turns off the faucet."
  },
  {
    "id": 12,
    "start_ts": 38.5,
    "end_ts": 40.0,
    "start_frame": 1155,
    "end_frame": 1200,
    "scene": "bathroom",
    "verb": "Picks up",
    "object": "squeegee",
    "action": "Picks up the squeegee."
  },
  {
    "id": 13,
    "start_ts": 40.0,
    "end_ts": 42.0,
    "start_frame": 1200,
    "end_frame": 1260,
    "scene": "bathroom",
    "verb": "Wipes",
    "object": "sink",
    "action": "Wipes the sink."
  },
  {
    "id": 14,
    "start_ts": 42.0,
    "end_ts": 44.0,
    "start_frame": 1260,
    "end_frame": 1320,
    "scene": "bathroom",
    "verb": "Attaches",
    "object": "cleaning pad to the toilet brush",
    "action": "Attaches the cleaning pad to the toilet brush."
  },
  {
    "id": 15,
    "start_ts": 44.0,
    "end_ts": 49.5,
    "start_frame": 1320,
    "end_frame": 1485,
    "scene": "bathroom",
    "verb": "Washes",
    "object": "sink",
    "action": "Washes the sink."
  },
  {
    "id": 16,
    "start_ts": 49.5,
    "end_ts": 53.5,
    "start_frame": 1485,
    "end_frame": 1605,
    "scene": "bathroom",
    "verb": "Wipes",
    "object": "sink",
    "action": "Wipes the sink."
  },
  {
    "id": 17,
    "start_ts": 53.5,
    "end_ts": 55.0,
    "start_frame": 1605,
    "end_frame": 1650,
    "scene": "bathroom",
    "verb": "Walks",
    "object": "to the toilet",
    "action": "Walks to the toilet."
  },
  {
    "id": 18,
    "start_ts": 55.0,
    "end_ts": 66.0,
    "start_frame": 1650,
    "end_frame": 1980,
    "scene": "bathroom",
    "verb": "Washes",
    "object": "toilet bowl",
    "action": "Washes the toilet bowl."
  },
  {
    "id": 19,
    "start_ts": 66.0,
    "end_ts": 68.0,
    "start_frame": 1980,
    "end_frame": 2040,
    "scene": "bathroom",
    "verb": "Walks",
    "object": "",
    "action": "Walks."
  },
  {
    "id": 20,
    "start_ts": 68.0,
    "end_ts": 68.5,
    "start_frame": 2040,
    "end_frame": 2055,
    "scene": "bathroom",
    "verb": "Picks up",
    "object": "squeegee",
    "action": "Picks up the squeegee."
  },
  {
    "id": 21,
    "start_ts": 68.5,
    "end_ts": 80.0,
    "start_frame": 2055,
    "end_frame": 2400,
    "scene": "bathroom",
    "verb": "Wipes",
    "object": "sink",
    "action": "Wipes the sink."
  },
  {
    "id": 22,
    "start_ts": 80.0,
    "end_ts": 86.0,
    "start_frame": 2400,
    "end_frame": 2580,
    "scene": "bathroom",
    "verb": "Washes",
    "object": "squeegee",
    "action": "Washes the squeegee."
  },
  {
    "id": 23,
    "start_ts": 86.0,
    "end_ts": 95.0,
    "start_frame": 2580,
    "end_frame": 2850,
    "scene": "bathroom",
    "verb": "Wipes",
    "object": "mirror",
    "action": "Wipes the mirror."
  },
  {
    "id": 24,
    "start_ts": 95.0,
    "end_ts": 96.5,
    "start_frame": 2850,
    "end_frame": 2895,
    "scene": "bathroom",
    "verb": "Washes",
    "object": "squeegee",
    "action": "Washes the squeegee."
  },
  {
    "id": 25,
    "start_ts": 96.5,
    "end_ts": 98.5,
    "start_frame": 2895,
    "end_frame": 2955,
    "scene": "bathroom",
    "verb": "Idle",
    "object": "",
    "action": "Idle."
  },
  {
    "id": 26,
    "start_ts": 98.5,
    "end_ts": 100.0,
    "start_frame": 2955,
    "end_frame": 3000,
    "scene": "bathroom",
    "verb": "Walks",
    "object": "",
    "action": "Walks."
  },
  {
    "id": 27,
    "start_ts": 100.0,
    "end_ts": 102.0,
    "start_frame": 3000,
    "end_frame": 3060,
    "scene": "bathroom",
    "verb": "Idle",
    "object": "",
    "action": "Idle."
  },
  {
    "id": 28,
    "start_ts": 102.0,
    "end_ts": 102.5,
    "start_frame": 3060,
    "end_frame": 3075,
    "scene": "bathroom",
    "verb": "Picks up",
    "object": "shower head",
    "action": "Picks up the shower head."
  },
  {
    "id": 29,
    "start_ts": 102.5,
    "end_ts": 106.5,
    "start_frame": 3075,
    "end_frame": 3195,
    "scene": "bathroom",
    "verb": "Wipes",
    "object": "shower head",
    "action": "Wipes the shower head."
  },
  {
    "id": 30,
    "start_ts": 106.5,
    "end_ts": 112.0,
    "start_frame": 3195,
    "end_frame": 3360,
    "scene": "bathroom",
    "verb": "Wipes",
    "object": "toilet",
    "action": "Wipes the toilet."
  },
  {
    "id": 31,
    "start_ts": 112.0,
    "end_ts": 141.5,
    "start_frame": 3360,
    "end_frame": 4245,
    "scene": "bathroom",
    "verb": "Wipes",
    "object": "floor",
    "action": "Wipes the floor."
  },
  {
    "id": 32,
    "start_ts": 141.5,
    "end_ts": 149.5,
    "start_frame": 4245,
    "end_frame": 4485,
    "scene": "bathroom",
    "verb": "Wipes",
    "object": "glass wall",
    "action": "Wipes the glass wall."
  },
  {
    "id": 33,
    "start_ts": 149.5,
    "end_ts": 153.5,
    "start_frame": 4485,
    "end_frame": 4605,
    "scene": "bathroom",
    "verb": "Walks",
    "object": "",
    "action": "Walks."
  },
  {
    "id": 34,
    "start_ts": 153.5,
    "end_ts": 155.5,
    "start_frame": 4605,
    "end_frame": 4665,
    "scene": "bathroom",
    "verb": "Picks up",
    "object": "squeegee",
    "action": "Picks up the squeegee."
  },
  {
    "id": 35,
    "start_ts": 155.5,
    "end_ts": 160.0,
    "start_frame": 4665,
    "end_frame": 4800,
    "scene": "bathroom",
    "verb": "Wipes",
    "object": "floor",
    "action": "Wipes the floor."
  },
  {
    "id": 36,
    "start_ts": 160.0,
    "end_ts": 178.5,
    "start_frame": 4800,
    "end_frame": 5355,
    "scene": "bathroom",
    "verb": "Sweeps",
    "object": "floor",
    "action": "Sweeps the floor."
  },
  {
    "id": 37,
    "start_ts": 178.5,
    "end_ts": 180.0,
    "start_frame": 5355,
    "end_frame": 5400,
    "scene": "bathroom",
    "verb": "Walks",
    "object": "",
    "action": "Walks."
  }
]
