[
  {
    "id": 1,
    "start_ts": 0.0,
    "end_ts": 4.0,
    "start_frame": 0,
    "end_frame": 120,
    "scene": "living room",
    "verb": "Picks up",
    "object": "bottle",
    "action": "Picks up the bottle."
  },
  {
    "id": 2,
    "start_ts": 4.0,
    "end_ts": 8.0,
    "start_frame": 120,
    "end_frame": 240,
    "scene": "living room",
    "verb": "Places",
    "object": "bottle",
    "action": "Places the bottle into the dustbin."
  },
  {
    "id": 3,
    "start_ts": 8.0,
    "end_ts": 12.0,
    "start_frame": 240,
    "end_frame": 360,
    "scene": "living room",
    "verb": "Picks up",
    "object": "white box",
    "action": "Picks up the white box."
  },
  {
    "id": 4,
    "start_ts": 12.0,
    "end_ts": 18.0,
    "start_frame": 360,
    "end_frame": 540,
    "scene": "living room",
    "verb": "Places",
    "object": "white box",
    "action": "Places the white box in the table."
  },
  {
    "id": 5,
    "start_ts": 18.0,
    "end_ts": 20.5,
    "start_frame": 540,
    "end_frame": 615,
    "scene": "living room",
    "verb": "Picks up",
    "object": "remote",
    "action": "Picks up the remote."
  },
  {
    "id": 6,
    "start_ts": 20.5,
    "end_ts": 22.5,
    "start_frame": 615,
    "end_frame": 675,
    "scene": "living room",
    "verb": "Places",
    "object": "remote",
    "action": "Places the remote in the table."
  }
]
